"","name","price","type","effect","volume","SPF","PA","skin_type","character","brand","sell"
"288","이자녹스 UV 선 프로 익스트림 선 100","14,800","크림형","피부보호","50ml(g)","SPF50+","PA+++",NA,"자외선차단","이자녹스","48"
"289","어퓨 퓨어 블록 톤업 선 베이스","4,400","튜브형","생기부여, 피부보호, 화이트닝, 피지조절","50ml(g)","50","PA+++",NA,"자외선차단, 지속력, 밀착력"," 어퓨","16"
"290","이지듀 데일리 워터프루프 선크림","16,060","크림형","피부보호, 백탁현상방지","60ml(g)","SPF50+","PA+++",NA,"워터프루프, 자외선차단","이지듀","6"
"291","더페이스샵 내추럴 선 에코 파워 롱래스팅 선크림","11,400","튜브형","피부톤보정","80ml(g)","50","PA+++",NA,"워터프루프","더페이스샵","51"
"292","더후 공진향 해윤 선크림","26,610","튜브형","수분공급, 생기부여","60ml(g)","50","PA+++","모든피부용","자외선차단","더후","54"
"293","네이처리퍼블릭 프로방스 카렌듈라 아이스 퍼프 선","15,760",NA,"피부보호, 화이트닝","100ml(g)","50","PA+++","모든피부용","자외선차단, 커버력, 주름개선, 메이크업베이스 겸용"," 네이처리퍼블릭","22"
"294","비오템 UV 수프림 자외선 차단제","41,900",NA,NA,"50ml(g)","50","PA+++","모든피부용","자외선차단","비오템","37"
"295","에뛰드하우스 선 프라이즈 내추럴 코렉터","5,600","크림형","윤기부여, 피부진정, 피부탄력, 피부톤보정, 화이트닝, 링클케어","50g","50+","PA+++","모든피부용","자외선차단, 지속력, 밀착력, 주름개선, 메이크업베이스 겸용","에뛰드하우스","45"
"296","니베아 페이스 선블럭 화이트닝 크림","5,930","크림형",NA,"50ml(g)","50","PA+++","모든피부용","자외선차단, 흡수력","니베아","57"
"297","스킨푸드 알로에 워터리 선 데일리","9,130","튜브형","피부보호","100ml(g)","50","PA+++","모든피부용","자외선차단","스킨푸드","106"
"298","보나벨라 데일리 선 블록","35,530","크림형","수분공급, 피부진정, 백탁현상방지","50ml(g)","50","PA+++","모든피부용","자외선차단","보나벨라","5"
"299","피몽쉐 울트라 하이드로 썬 에센스","38,810","크림형","피부보호, 피부진정, 백탁현상방지","50ml(g)","SPF50+","PA+++","모든피부용","자외선차단"," 피몽쉐","10"
"300","정관장 동인비 퍼펙트 선크림","32,990","크림형","수분공급","50ml(g)","SPF50+","PA+++","모든피부용","자외선차단"," 정관장","10"
"301","MISSHA 올 어라운드 세이프 블록 에센스 선 밀크","10,600",NA,"수분공급","70ml(g)","50","PA+++",NA,"자외선차단","MISSHA","31"
"302","히스토랩 포스트 레이저 선 블럭 365","41,000","크림형","피부진정","50ml(g)","SPF50+","PA+++","모든피부용","자외선차단"," 히스토랩","6"
"303","슈얼리 토탈 액티브 선 프로텍션","17,400","튜브형","수분공급, 피부보호, 피지조절","50ml(g)","50","PA+++","지성","자외선차단","슈얼리","20"
"304","더페이스샵 내추럴선 에코 민감피부 안심 선","7,160","크림형",NA,"50ml(g)","SPF40","PA+++","민감성","자외선차단, 저자극","더페이스샵","8"
"305","던롭 UV 디펜스 투명 선스틱","10,800","스틱형","백탁현상방지","15ml(g)","SPF50+","PA++++",NA,"워터프루프, 자외선차단","던롭","14"
"306","베리떼 매트터치 선 크림","11,870","크림형","피부보호, 피지조절","50ml(g)","SPF30","PA++","모든피부용","자외선차단, 저자극","베리떼","33"
"307","닥터영 아쿠아 선 케어 밀크","24,870","크림형","백탁현상방지","50ml(g)","SPF50+","PA+++","모든피부용","자외선차단"," 닥터영","21"
"308","오키드 유브이 선 크림 옐로우","8,010","크림형","수분공급, 피부진정","50ml(g)","SPF50+","PA+++","모든피부용","자외선차단",NA,"10"
"309","더블업 루미너스 선 에센스","7,900","크림형","백탁현상방지","50ml(g)","SPF50+","PA+++",NA,"워터프루프, 자외선차단, 주름개선"," 더블업","5"
"310","스위스킨 데일리 디펜스 선스크린 플러스","18,140","크림형","수분공급, 피부진정","50ml(g)","SPF50+","PA++++","모든피부용","자외선차단"," 스위스킨","21"
"311","애터미 선 크림 화이트","7,380","크림형","수분공급, 피부보호, 피부진정, 백탁현상방지","60ml(g)","50","PA+++",NA,"자외선차단, 발림성, 무동물성원료, 보습","애터미","16"
"312","에뛰드하우스 선 프라이즈 마일드 에어리 피니쉬","6,750",NA,NA,"55ml(g)","50","PA+++","모든피부용","자외선차단, 미네랄 함유","에뛰드하우스","75"
"313","스팟콘 캐쥬얼 티 선 스크린","12,500","크림형","수분공급, 피부보호, 피부진정, 피지조절, 백탁현상방지","60ml(g)","SPF50+","PA+++",NA,"자외선차단"," 스팟콘","9"
"314","라운드랩 365 안심 선크림","20,000","크림형","수분공급, 피부보호","50ml(g)","SPF50+","PA++++","모든피부용","자외선차단, 보습"," 라운드랩","1"
"315","이자녹스 UV 선 프로 뷰티 선","16,590","크림형",NA,"50ml(g)","SPF50+","PA++++",NA,"자외선차단, 주름개선"," 이자녹스","66"
"316","쎄라덤 오가50 썬블럭","30,700","크림형","백탁현상방지","40ml(g)","SPF50+","PA+++","모든피부용, 민감성","자외선차단","쎄라덤","7"
"317","메디힐 스킨데일리 선크림","7,650","크림형","피부진정","60ml(g)","SPF50+","PA+++",NA,"워터프루프, 자외선차단","메디힐","5"
"318","제노셀 스킨 메소드 선프로셀 선크림","40,000","크림형","피부보호","40ml(g)","SPF40","PA++",NA,"자외선차단, 주름개선"," 제노셀","1"
"319","비욘드 키즈 에코 디즈니 선크림","14,260","크림형","피부보호","70ml(g)","SPF40","PA+++",NA,"자외선차단"," 비욘드","14"
"320","셀린저 라바 옐로우 프레쉬 선블록","13,000","크림형","수분공급","50ml(g)","SPF50+","PA++++","모든피부용","자외선차단, 주름개선"," 셀린저","9"
"321","물광 톤업 선크림","30,000","크림형","수분공급, 피부보호","50ml(g)","SPF50+","PA+++",NA,"자외선차단, 주름개선",NA,"1"
"322","다도센스 썬크림 키즈","18,910","크림형",NA,"125ml(g)","SPF45",NA,"모든피부용","자외선차단","다도센스","7"
"323","프라우드메리 UV 디펜스 마일드 선블럭","9,800","크림형","수분공급, 피부진정, 백탁현상방지","50ml(g)","SPF50+","PA++++",NA,"자외선차단"," 프라우드메리","31"
"324","디아랑쉬 울트라 릴리프 UV 프로텍터","15,990","크림형","피부보호","50ml(g)","SPF50+","PA+++",NA,"자외선차단"," 디아랑쉬","9"
"325","UV 비타 톤업 선쿠션","55,000",NA,"피부진정","23ml(g)","SPF50+","PA++++",NA,"자외선차단, 보습, 주름개선",NA,"1"
"326","스틸라 브라이트닝 UV 쉴드","14,900","크림형","백탁현상방지","50ml(g)","SPF50+","PA+++","모든피부용","자외선차단, 주름개선"," 스틸라","7"
"327","스킨푸드 알로에 워터리 쿨링 선 쿠션","9,340","쿠션형","수분공급, 피부보호, 피부진정, 화이트닝, 백탁현상방지","13ml(g)","50","PA++++",NA,"자외선차단, 쿨링감, 주름개선","스킨푸드","120"
"328","땡큐파머 선 프로젝트 쉬머 선 에센스","8,860","크림형","피부보호, 피부진정","15ml(g)","SPF30","PA++","모든피부용, 민감성","자외선차단, 보습, 주름개선"," 땡큐파머","88"
"329","설화수 수율 선 플루이드","31,750",NA,"수분공급","50ml(g)","50","PA+++","모든피부용","자외선차단, 보습","설화수","338"
"330","에끌라두 플러스 컬렉션 오일프리 선크림","35,625","크림형","수분공급, 피지조절, 백탁현상방지","70ml(g)","40","PA++","모든피부용","자외선차단, 저자극, 밀착력, 오일 프리","에끌라두","6"
"331","알바트로스 파우더 선","11,900","튜브형","피부보호","70ml(g)","41","PA++",NA,"자외선차단","알바트로스","107"
"332","딸고 에이지 디펜스 선 스크린 크림","39,900","튜브형","피부보호","50ml(g)","50",NA,"모든피부용","자외선차단, 지속력","딸고","26"
"333","보나벨라 데일리 선블록","36,100","크림형","피부진정","50ml(g)","SPF50","PA+++",NA,"워터프루프, 자외선차단, 보습"," 보나벨라","1"
"334","더레브 아줄렌 선베이스","32,000","크림형","수분공급, 피부진정","50ml(g)","SPF50+","PA+++","모든피부용, 민감성","자외선차단, 지속력","더레브","6"
"335","수려한 백삼 미백 안색 선 크림","12,900","리퀴드형","수분공급, 영양공급, 생기부여, 피부보호, 피부진정, 화이트닝","60ml(g)","50","PA+++","모든피부용","자외선차단, 주름개선","수려한","102"
"336","더페이스샵 내추럴선 에코 포토제닉 선 블러","6,200","튜브형",NA,"45ml(g)","50","PA+++",NA,"자외선차단","더페이스샵","38"
"337","베니즈와 퍼펙트 선 프로텍터","7,250","크림형","피부보호, 피부진정","50ml(g)","SPF50+","PA+++",NA,"자외선차단, 보습"," 베니즈와","6"
"338","마몽드 엔프라니 마일드 선 블록","6,120","크림형","피부보호","70ml(g)","SPF35","PA+++",NA,"자외선차단"," 마몽드","13"
"339","아이소이 민감피부 걱정마 착한 선크림","23,810","크림형","백탁현상방지","55ml(g)","SPF30","PA+++","민감성","자외선차단, 주름개선"," 아이소이","15"
"340","셀레뷰 브라이트닝 에션셜 UV 프로텍터","18,900","크림형","수분공급, 피부보호","50ml(g)","SPF50+","PA++++","모든피부용","자외선차단, 저자극, 주름개선"," 셀레뷰","34"
"341","이엔코스 3 멀티 블럭 틴티드 크림","31,500",NA,"수분공급, 피부보호, 피부유연, 피부탄력, 화이트닝, 백탁현상방지","50ml(g)","50","PA+++","모든피부용, 민감성","자외선차단, 미네랄 함유, 발림성, 주름개선","이엔코스","28"
"342","달팡 쏠레일 플레져 안티에이징 선 프로텍티브 크림 포 바디","43,480","크림형","피부보호","50ml(g)","SPF30",NA,"모든피부용","자외선차단"," 달팡","1"
"343","루트리 모비테라피 UV 선 쉴드","20,890","크림형","수분공급, 백탁현상방지","60ml(g)","SPF50+","PA++++",NA,"자외선차단, 주름개선"," 루트리","16"
"344","톡스앤필 비타메디 선 로션 튜브형","15,350","크림형","수분공급, 백탁현상방지","50ml(g)","SPF50+","PA+++","모든피부용","자외선차단"," 톡스앤필","9"
"345","스킨푸드 드래곤 프룻 파워풀 선 에센스 ","7,590","튜브형","수분공급, 피부보호","50ml(g)","50","PA++++",NA,"자외선차단","스킨푸드","100"
"346","스킨푸드 알로에 워터리 선 워터 젤","7,690","튜브형",NA,"50ml(g)","50","PA+++","모든피부용","워터프루프, 자외선차단","스킨푸드","102"
"347","차앤박 오메가 퍼펙션 선블럭","13,570",NA,"수분공급, 영양공급, 피부진정","50ml(g)","50","PA+++","모든피부용, 건성, 민감성","자외선차단, 비타민 함유","차앤박","35"
"348","폴라초이스 리지스트 데일리 플루이드","31,190","크림형",NA,"60ml(g)","SPF50",NA,"모든피부용","자외선차단"," 폴라초이스","4"
"349","빈스캐빈 노란콩 선크림","9,610","캡형","피부진정","60ml(g)","SPF35","PA++","민감성","자외선차단"," 빈스캐빈","6"
"350","온뜨레 마르게리따 겔 데일리 선 프로텍션","34,700","크림형","백탁현상방지","60ml(g)","SPF30","PA++","모든피부용","자외선차단"," 온뜨레","30"
"351","어퓨 파워 블록 에센스 선크림 ","5,660","크림형","백탁현상방지","50ml(g)","SPF50+","PA++++","모든피부용","자외선차단","어퓨","45"
"352","A24 프리미엄 썬 프로텍션 크림","34,200","크림형","수분공급, 피부보호, 화이트닝, 백탁현상방지","60ml(g)","50","PA+++",NA,"워터프루프, 자외선차단, 저자극, 지속력, 오가닉, 천연성분, 파라벤 프리, 발림성, 보습, 주름개선, 메이크업베이스 겸용","A24","8"
"353","어글리덕 미라클 멀티 쉴드 선 젤","17,820","크림형","수분공급, 피부보호, 백탁현상방지","60ml(g)","SPF50+","PA+++","모든피부용","자외선차단"," 어글리덕","13"
"354","MISSHA 올 어라운드 세이프 블록 워터프루프 선 ","6,480","튜브형","피부보호, 피부진정","50ml(g)","50","PA++++",NA,"워터프루프, 자외선차단, 지속력"," MISSHA","75"
"355","네이처리퍼블릭 캘리포니아 알로에 워터프루프 선블럭","10,120","튜브형","수분공급, 피부보호, 피부진정","60ml(g)","50","PA++++","모든피부용","워터프루프, 자외선차단, 저자극, 보습","네이처리퍼블릭","47"
"356","크레모랩 UV 프로텍션 더 미네랄 쉴드","24,490","크림형","피부진정, 백탁현상방지","50ml(g)","SPF50+","PA++++","모든피부용","자외선차단"," 크레모랩","4"
"357","보나쥬르 데일리 마일드 선 퍼펙트 쉴드","14,760","크림형","피부보호, 백탁현상방지","35ml(g)","SPF33","PA++",NA,"자외선차단"," 보나쥬르","8"
"358","온더바디 내추럴 리프레쉬 페이스 앤 바디 선 로션","4,570","크림형","수분공급, 피부보호, 피부진정, 피부투명, 백탁현상방지","150ml(g)","50","PA+++",NA,"자외선차단, 발림성, 보습, 글리세린","온더바디","51"
"359","닥터지 워터프루프 업 선","16,270","크림형","수분공급","70ml(g)","SPF50+","PA++++","모든피부용","워터프루프, 자외선차단"," 닥터지","29"
"360","히스토랩 센시티브 스킨 선 블럭 포에버 플러스","34,500","튜브형","수분공급, 영양공급, 피부보호","50ml(g)","50","PA+++","건성, 민감성","자외선차단","히스토랩","16"
"361","이니스프리 퍼펙트 UV 프로텍션 크림 롱 래스팅","8,200","튜브형","수분공급","50ml(g)","50","PA++++","모든피부용, 중건성","자외선차단","이니스프리","46"
"362","마몽드 카렌듈라 에센스 선 밀크","7,110",NA,"수분공급, 피부보호, 백탁현상방지","35ml","50","PA+++","모든피부용","자외선차단, 지속력, 밀착력","마몽드","151"
"363","비욘드 에코 디펜스 퍼펙트 워터프루프 선 크림","10,140","크림형","피부보호, 피부진정","55ml(g)","SPF50+","PA+++",NA,"워터프루프, 자외선차단, 저자극","비욘드","18"
"364","산소수 톤 업 선 크림 삐삐롱스타킹 에디션","13,800","크림형",NA,"50ml(g)","SPF50+","PA++++","모든피부용","자외선차단, 주름개선",NA,"2"
"365","시세이도 화이트 루센트 올 데이 브라이트너 N","58,660","크림형",NA,"50ml(g)","SPF50+","PA++++","모든피부용","자외선차단"," 시세이도","5"
"366","온더바디 페이스 앤 바디 퍼펙트 선 로션","2,580",NA,"피부보호","50ml(g)","50","PA+++",NA,"자외선차단, 밀착력, 발림성","온더바디","78"
"367","몽디에스 모어네추럴 선 스크린","22,287","크림형","수분공급, 백탁현상방지","50ml(g)","SPF50+","PA+++","모든피부용","자외선차단"," 몽디에스","12"
"368","르퀼라야 퓨어텐 선크림","7,920","크림형",NA,"50ml(g)","SPF50+","PA+++","모든피부용","자외선차단, 저자극","르퀼라야","30"
"369","빌라쥬11팩토리 데일리 마일드 선크림","7,620","크림형","피부보호, 피부진정","50ml(g)","SPF50+","PA++++",NA,"자외선차단","빌라쥬11팩토리","28"
"370","쏭레브 데일리 썬 프로텍션","27,420","크림형","피부보호","60ml(g)","SPF43","PA+++","모든피부용","자외선차단"," 쏭레브","4"
"371","라네즈 워터리 선 크림 ","13,480",NA,"수분공급","50ml(g)","50","PA++++",NA,"워터프루프, 자외선차단","라네즈","205"
"372","시드물 내츄럴 선크림","8,800","튜브형","수분공급, 피부보호, 피부유연, 피부톤보정, 백탁현상방지","60ml(g)","35","PA++","모든피부용","자외선차단","시드물","2"
"373","아미니 내추럴 선블럭","7,800","크림형","피부진정, 백탁현상방지","50ml(g)","SPF35","PA++","모든피부용","자외선차단"," 아미니","15"
"374","에스쁘아 프로 엑스트라 프로텍티브 선 베이스","18,540","튜브형","수분공급, 윤기부여, 생기부여, 피부보호","50ml(g)","50","PA+++","모든피부용","자외선차단","에스쁘아","45"
"375","닥터오라클 안티박 더마 라이트 선에센스","35,150","크림형","피부보호","60ml(g)","SPF50+","PA+++","민감성","자외선차단, 저자극","닥터오라클","6"
"376","키엘 울트라 라이트 데일리 UV 디펜스 미네랄 선 스크린","30,900",NA,NA,"50ml(g)","50","PA+++","민감성","자외선차단, 저자극","키엘","15"
"377","네이처리퍼블릭 캘리포니아 알로에 데일리 선 블럭 ","4,700","크림형","수분공급, 피부진정","57ml","50","PA++++","모든피부용","자외선차단, 밀착력, 천연성분, 보습, 메이크업베이스 겸용, 글리세린"," 네이처리퍼블릭","90"
"378","니베아 엑스트라 화이트 페이스 선 블록","9,790","크림형",NA,"50ml(g)","SPF50+","PA+++","모든피부용","자외선차단"," 니베아","88"
"379","이니스프리 에코 세이프티 퍼펙트 워터프루프 선블록","10,500","크림형","피부보호, 화이트닝","50ml(g)","50","PA+++",NA,"자외선차단, 지속력, 발림성, 주름개선","이니스프리","5"
"380","스킨푸드 알로에 워터리 선 노 세범","7,690","튜브형","수분공급, 피부보호, 피부유연, 피지조절","50ml(g)","50","PA+++","모든피부용","워터프루프, 자외선차단","스킨푸드","61"
"381","푸드어홀릭 멀티 선크림","1,310","튜브형","피부보호, 화이트닝","70ml(g)","50","PA+++",NA,"자외선차단, 지속력","푸드어홀릭","34"
"382","더페이스샵 내추럴 선 에코 파워 롱래스팅 선 크림","8,070","튜브형",NA,"50ml(g)","50","PA+++",NA,"워터프루프, 자외선차단","더페이스샵","76"
"383","크리니크 수퍼 시티 블럭 오일-프리 데일리 페이스 프로텍터","24,960","튜브형","피부보호","40ml(g)","40","PA+++",NA,"자외선차단","크리니크","15"
"384","이자녹스 UV 선 프로 링클 케어","14,910","튜브형","피부보호, 피부톤보정","70ml","50","PA+++","모든피부용","워터프루프, 자외선차단, 지속력, 발림성, 주름개선, BB크림 겸용","이자녹스","180"
"385","클리오 킬 프로텍션 톤업 선 베이스","9,110",NA,"수분공급, 피부유연, 화이트닝","50ml(g)","50","PA+++",NA,"자외선차단","클리오","34"
"386","토니모리 비씨데이션 멀티 유즈 선 오일 ","10,700",NA,NA,"30ml","50",NA,"모든피부용","자외선차단, 흡수력, 지속력, 발림성","토니모리","74"
"387","니슬 에코 베리어 논 케미컬 선 크림","24,270","크림형","수분공급, 영양공급, 피부보호, 피부진정, 백탁현상방지","50ml(g)","SPF50+","PA+++",NA,"자외선차단","니슬","11"
"388","IWLT 프로텍티브 베이스 선 크림","31,840","크림형","피지조절, 백탁현상방지","40ml(g)","SPF50+","PA+++","지성","자외선차단, 주름개선"," IWLT","4"
"389","빌리프 UV 프로텍터 데일리 선스크린 젤 ","21,650","젤형","수분공급, 피부보호, 화이트닝, 백탁현상방지","30ml(g)","50","PA++",NA,"자외선차단, 발림성","빌리프","32"
"390","더마비 에브리데이 선 크림","12,370","크림형","수분공급, 영양공급, 피부진정","205ml(g)","SPF50+","PA+++",NA,"워터프루프, 자외선차단","더마비","31"
"391","디오프러스 유브이 디펜스 선 프로텍터","13,900","크림형","수분공급","70ml(g)","SPF50+","PA+++",NA,"자외선차단","디오프러스","3"
"392","마몽드 퓨어 센서티브 선 크림 ","6,620","튜브형","수분공급, 피부진정","40ml(g)","45","PA++",NA,"자외선차단, 저자극, 무동물성원료","마몽드","148"
"393","레노마 노블리티 논스탑 3웨이 선 크림","10,060","크림형",NA,"100ml(g)","SPF50+","PA+++",NA,"자외선차단","레노마","22"
"394","한국화장품 산수유 고은결 진 선크림","4,210","크림형","영양공급, 피부보호","70ml(g)","SPF50+","PA+++","모든피부용","자외선차단, 주름개선","한국화장품","141"
"395","참존 알바트로스 레포츠 선","12,810","크림형","백탁현상방지","60ml(g)","SPF50+","PA+++",NA,"워터프루프, 자외선차단","참존","29"
"396","MISSHA 올 어라운드 세이프 블록 데일리 선 ","6,390","크림형","수분공급, 피부보호, 피부진정, 백탁현상방지","50ml(g)","50","PA++++",NA,"워터프루프, 자외선차단, 지속력, 밀착력"," MISSHA","80"
"397","디엠에스 더모에센셜 선 레스큐 크림","38,000","튜브형","수분공급, 피부보호, 백탁현상방지","50ml(g)","50","PA+++","모든피부용","자외선차단","디엠에스","26"
"398","유세린 선 젤 크림 드라이 터치","22,900","젤형","수분공급, 피부보호, 피부유연","50ml(g)","50","PA+++","지성","자외선차단, 흡수력, 지속력","유세린","28"
"399","예브랑 센서티브 선크림","13,160","크림형","백탁현상방지","50ml(g)","SPF43","PA++","민감성","자외선차단"," 예브랑","5"
"400","라네즈 마시멜로우 선 쿠션 ","9,170","쿠션형","수분공급, 피부보호, 피부진정","10ml(g)","50","PA+++",NA,"자외선차단","라네즈","158"
"401","크레모랩 UV 프로텍션 아쿠아 오투 쉴드","20,370","크림형","수분공급","50ml(g)","SPF50+","PA++++",NA,"자외선차단","크레모랩","25"
"402","코리아나 라비다 선 솔루션 데일리 IRF20","18,610","튜브형","수분공급, 피부보호, 화이트닝","60ml(g)","36","PA+++",NA,"자외선차단","코리아나","51"
"403","잇츠스킨 프레스티지 선 데스까르고","11,150",NA,NA,"50ml(g)","50","PA+++","건성, 복합, 지성","자외선차단","잇츠스킨","135"
"404","크리니크 이븐 베터 시티 블록 안티 폴루션","35,000","크림형",NA,"30ml(g)","SPF40","PA+++",NA,"자외선차단","크리니크","2"
"405","끌레드뽀보떼 에뮐씨옹 프로텍트리스 UV 뿌르 르 꼬르","79,050","크림형","수분공급","75ml(g)","SPF30","PA+++","모든피부용","자외선차단, 주름개선"," 끌레드뽀보떼","17"
"406","어퓨 퓨어 블록 마일드 플러스 선크림","3,950","튜브형",NA,"50ml(g)","32","PA++",NA,"자외선차단, 저자극"," 어퓨","31"
"407","더바디샵 스킨 디펜스 멀티 프로텍션 에센스","24,480","튜브형","피부보호, 피부유연, 백탁현상방지","60ml(g)","50+","PA++++",NA,"자외선차단, 지속력","더바디샵","12"
"408","셀린저 라바 옐로우 프레쉬 선 스틱","14,680","스틱형","영양공급","22ml(g)","SPF50+","PA++++","모든피부용","자외선차단, 보습"," 셀린저","28"
"409","라네즈 라이트 선 플루이드 ","10,950",NA,"수분공급, 피부보호, 유수분밸런스조절","50ml(g)","50","PA+++","모든피부용","워터프루프, 자외선차단, 밀착력","라네즈","249"
"410","닥터자르트 트루라이트 에센스 선크림","21,270","튜브형","수분공급, 피부보호, 피부탄력, 화이트닝","50ml(g)","45","PA+++","건성, 복합, 지성, 민감성","자외선차단","닥터자르트","30"
"411","르네셀 앱솔루트 슈프림 선 블럭","23,020","튜브형",NA,"50ml(g)","50","PA+++",NA,"자외선차단, 저자극, 밀착력","르네셀","18"
"412","에스티로더 크레센트 화이트 UV 프로텍터","42,370","튜브형","수분공급, 피부보호, 피부진정, 화이트닝","30ml(g)","50","PA+++","모든피부용","자외선차단, 저자극","에스티로더","65"
"413","해피바스 아쿠아 모이스춰 선 젤 ","5,400","젤형","수분공급, 피부보호","75ml(g)","50","PA+++",NA,"자외선차단, 쿨링감","해피바스","77"
"414","아웃런 울트라 마라톤 선 크림","9,700","튜브형",NA,"70ml(g)","50","PA+++",NA,"자외선차단, 흡수력","아웃런","25"
"415","스킨푸드 로열 허니 착한 선 젤","5,300","젤형","피부보호","50ml(g)","30","PA++","모든피부용, 민감성","자외선차단","스킨푸드","161"
"416","온뜨레 갸마르드 쏠레흐 오뜨 프로떽씨옹","30,060","크림형","백탁현상방지","40ml(g)","SPF50","PA++++",NA,"자외선차단","온뜨레","17"
"417","니베아 페이스 선블럭 모이스처라이징 크림","6,600","튜브형","수분공급, 피부보호","50ml(g)","50","PA+++","모든피부용","자외선차단, 비타민 함유","니베아","71"
"418","아웃런 울트라 서핑 선 크림","12,970","크림형","피부보호","70ml(g)","50","PA++++",NA,"워터프루프, 자외선차단, 흡수력, 밀착력","아웃런","16"
"419","프라우드메리 데일리 모이스춰 선밀크","9,900","크림형","피부진정","40ml(g)","SPF50+","PA++++","모든피부용","자외선차단"," 프라우드메리","33"
"420","에뛰드하우스 선 프라이즈 레포츠 워터프루프","7,650",NA,"피부활력, 피부보호, 화이트닝","50ml(g)","50","PA+++","모든피부용","워터프루프, 자외선차단, 주름개선","에뛰드하우스","163"
"421","에스티로더 리 뉴트리브 래디언트 유브리 베이스","107,920","크림형",NA,"30ml(g)","SPF50","PA+++","모든피부용","자외선차단, 주름개선"," 에스티로더","6"
"422","화진화장품 예브랑 선크림","13,990","튜브형","피부보호","50ml(g)","40","PA++",NA,"자외선차단","화진화장품","8"
